{
  "skillId": "pentest",
  "version": 1,
  "name": "Pentest",
  "tagline": "An authorized security test of your own app — cheap agents grind the surface, and every finding is proven, never guessed.",
  "who": "Teams who want to security-test their own app before someone else does — engineers and founders with a repo they own and a staging URL they control, who want proven findings, not a scanner's noise.",
  "how": "It starts by demanding written authorization: what you own or may test, exact in-scope hosts and paths, a test account, and what's off limits — recorded before a single packet leaves. Then your agent acts as the coordinator: it reads the code you own to map every input-to-sink, drives the live app once to learn its real requests, and fans dozens of cheap forked sub-agents across the surface — one tool against one target each (nuclei, ffuf, sqlmap, dalfox, secrets scanners). It keeps the reasoning about chains and severity for itself and gives the grinding away. Nothing is reported on a hunch: every finding carries an executed proof — a payload that ran in a real browser, an out-of-band callback that fired, an oracle diff, or an exact secret at file:line — and anything unproven is dropped. You get a written report plus a findings sheet, delivered to you and no one else. It only ever proves a bug exists; it never dumps data, brute-forces, or moves beyond proof.",
  "shelf": "security",
  "accent": "oklch(0.62 0.18 25)",
  "connectors": [],
  "outputs": [
    "doc"
  ],
  "runs": "once",
  "changelog": "First version."
}
